<?xml version="1.0" encoding="iso-8859-1"?>
<phpwebtk xmlns:xsi="http://www.w3.org/2001/XMLSchema-instance"
	xsi:noNamespaceSchemaLocation="phpwebtk.xsd">
	<crypt>
		<randomDevice>1</randomDevice>
		<blockAlgorithm>rijndael-256</blockAlgorithm>
		<blockAlgorithmMode>cbc</blockAlgorithmMode>
		<encryptionKey>rGt6L2m2p2WLd8mcSSo3ZHyMXkua0k+B4XigVALNHck2NDIxMzIyOTIxMDE2MDE3MzI1MTE0Nw==</encryptionKey>
	</crypt>
	<digest>
		<randomDevice>0</randomDevice>
		<saltedS2kAlgorithm>1</saltedS2kAlgorithm>
		<digestAlgorithm>17</digestAlgorithm>
	</digest>
	<hmac>
		<randomDevice>0</randomDevice>
		<saltedS2kAlgorithm>1</saltedS2kAlgorithm>
		<hmacAlgorithm>17</hmacAlgorithm>
		<hmacKey>mX0rcd/k8+1q8dLJ4Q9y++kTK497ROwFh0QkYAE8iJI=</hmacKey>
	</hmac>
	<mysql>
		<driver>mysqli</driver>
		<username>username</username>
		<password>password</password>
		<hostname>localhost</hostname>
		<database>sampledb</database>
		<persistent>1</persistent>
		<debug>0</debug>
		<fetchmode>2</fetchmode>
		<clientflags>32</clientflags>
		<socket>/var/lib/mysql/mysql.sock</socket>
	</mysql>
	<prng>
		<randomDevice>1</randomDevice>
	</prng>
	<session>
		<savePath>/var/www/sessions</savePath>
		<name>session</name>
		<entropyFile>/dev/urandom</entropyFile>
		<entropyLength>16</entropyLength>
		<useOnlyCookies>1</useOnlyCookies>
		<cookieLifetime>500</cookieLifetime>
		<cookiePath>/</cookiePath>
		<cookieDomain>localhost</cookieDomain>
		<cookieSecure>0</cookieSecure>
		<cacheLimiter>private_no_expire</cacheLimiter>
		<cacheExpire>180</cacheExpire>
		<hashFunction>1</hashFunction>
		<hashBitsPerCharacter>6</hashBitsPerCharacter>
	</session>
</phpwebtk>
